{
  "$schema": "https://json-schema.org/draft/2020-12/schema",
  "$id": "https://mcp-3d/spec/v3/ground-truth.schema.json",
  "title": "SyntheticGroundTruth",
  "description": "Known-answer ground truth for the synthetic debug demo. Used by the assertion harness to compare estimated outputs against exact analytical values.",
  "type": "object",
  "required": ["scene_duration_us", "trajectories"],
  "properties": {
    "_comment": {
      "type": "string",
      "description": "Human-readable comment for documentation purposes (ignored by validators)"
    },
    "scene_duration_us": {
      "type": "integer",
      "exclusiveMinimum": 0,
      "description": "Total scene duration (must match scene.json)"
    },
    "seed": {
      "type": "integer",
      "description": "RNG seed used to generate this ground truth"
    },
    "trajectories": {
      "type": "array",
      "minItems": 1,
      "items": { "$ref": "#/$defs/TrajectoryGroundTruth" },
      "description": "Analytical ground truth for each trajectory defined in scene.json"
    },
    "camera_projections": {
      "type": "array",
      "items": { "$ref": "#/$defs/CameraProjectionGroundTruth" },
      "description": "Analytical 2D projections of each trajectory onto each camera"
    },
    "expected_assets": {
      "$ref": "#/$defs/ExpectedAssets",
      "description": "Structural expectations for the generated asset bundle"
    }
  },
  "additionalProperties": false,
  "$defs": {

    "Vec3": {
      "type": "array",
      "items": { "type": "number" },
      "minItems": 3,
      "maxItems": 3
    },

    "Vec2": {
      "type": "array",
      "items": { "type": "number" },
      "minItems": 2,
      "maxItems": 2
    },

    "TrajectoryPoint": {
      "type": "object",
      "required": ["t_us", "position"],
      "properties": {
        "t_us": {
          "type": "integer",
          "description": "Timestamp in microseconds"
        },
        "position": {
          "$ref": "#/$defs/Vec3",
          "description": "Exact world-frame position at this timestamp"
        }
      },
      "additionalProperties": false
    },

    "TrajectoryGroundTruth": {
      "type": "object",
      "required": ["id", "sample_points"],
      "properties": {
        "id": {
          "type": "string",
          "description": "Must match a trajectory id in scene.json"
        },
        "sample_points": {
          "type": "array",
          "items": { "$ref": "#/$defs/TrajectoryPoint" },
          "minItems": 2,
          "description": "Analytical sample positions at known timestamps. Harness interpolates between these."
        },
        "total_arc_length_m": {
          "type": "number",
          "minimum": 0,
          "description": "Total path length in metres (used to verify trajectory generator output)"
        }
      },
      "additionalProperties": false
    },

    "ProjectionPoint": {
      "type": "object",
      "required": ["t_us", "pixel"],
      "properties": {
        "t_us": {
          "type": "integer",
          "description": "Timestamp in microseconds"
        },
        "pixel": {
          "$ref": "#/$defs/Vec2",
          "description": "Exact 2D projection [x_px, y_px] in the camera image plane (before any discretisation)"
        },
        "visible": {
          "type": "boolean",
          "description": "Whether the projected point falls within the camera resolution",
          "default": true
        }
      },
      "additionalProperties": false
    },

    "CameraProjectionGroundTruth": {
      "type": "object",
      "required": ["camera_id", "trajectory_id", "sample_points"],
      "properties": {
        "camera_id": {
          "type": "string",
          "description": "Must match a camera id in cameras.json"
        },
        "trajectory_id": {
          "type": "string",
          "description": "Must match a trajectory id in scene.json"
        },
        "sample_points": {
          "type": "array",
          "items": { "$ref": "#/$defs/ProjectionPoint" },
          "minItems": 2,
          "description": "Analytical projections at known timestamps"
        }
      },
      "additionalProperties": false
    },

    "TrackletExpectation": {
      "type": "object",
      "required": ["trajectory_id"],
      "properties": {
        "trajectory_id": {
          "type": "string",
          "description": "The scene trajectory this tracklet should correspond to"
        },
        "min_point_count": {
          "type": "integer",
          "minimum": 1,
          "description": "Minimum number of triangulated points expected in the tracklet"
        },
        "max_position_error_m": {
          "type": "number",
          "exclusiveMinimum": 0,
          "description": "Maximum allowed RMS position error against analytical trajectory (metres)"
        },
        "max_time_error_us": {
          "type": "integer",
          "minimum": 0,
          "description": "Maximum allowed timestamp error per point (microseconds)"
        },
        "max_reprojection_error_px": {
          "type": "number",
          "minimum": 0,
          "description": "Maximum allowed mean reprojection error (pixels)"
        }
      },
      "additionalProperties": false
    },

    "ExpectedAssets": {
      "type": "object",
      "properties": {
        "event_frame_count_per_camera": {
          "type": "integer",
          "minimum": 1,
          "description": "Expected number of event-frame-2d assets per camera"
        },
        "tracklet_count": {
          "type": "integer",
          "minimum": 1,
          "description": "Expected number of event-tracklet-3d assets"
        },
        "tracklets": {
          "type": "array",
          "items": { "$ref": "#/$defs/TrackletExpectation" },
          "description": "Per-trajectory expectations for tracklet quality"
        },
        "derived_from_dag_closed": {
          "type": "boolean",
          "description": "Assertion: all derived_from references resolve to known asset IDs in the bundle",
          "default": true
        }
      },
      "additionalProperties": false
    }

  }
}
